{"config_sha256":"b4655aeda3f16e82b24bd7c93275e8dbb7f6db18f47b6b86fa679de94f5b3297","created_at_utc":"2026-09-23T10:09:12Z","effective_at_utc":"2026-09-23T10:10:00Z","forecast_id":"20260923T100912Z-f94865f1c9c3-oracle-v4","ledger_state_sha256":"8925e80ad087b49770bac447d34ac72cebc96b17384e8d52007c107de2208c60","management":[{"action":"CANCEL","client_id":"20260923T081030Z-ff508633a4d9-oracle-v4-1"}],"orders":[],"quote":{"ask":"1.1666","bid":"1.1656"},"strategy_version":"oracle-v4.0.0"}
