{"config_sha256":"b4655aeda3f16e82b24bd7c93275e8dbb7f6db18f47b6b86fa679de94f5b3297","created_at_utc":"2026-09-24T05:10:15Z","effective_at_utc":"2026-09-24T05:11:00Z","forecast_id":"20260924T051015Z-9f77e2fb0a71-oracle-v4","ledger_state_sha256":"95718871a0804b72fbc0a633973ad6cc7e5d8153c2084d983bc01830b00f23b6","management":[{"action":"CANCEL","client_id":"20260924T030925Z-2b890926a8bd-oracle-v4-1"}],"orders":[],"quote":{"ask":"1.1285","bid":"1.1284"},"strategy_version":"oracle-v4.0.0"}
